{
  "$schema": "https://json-schema.org/draft/2020-12/schema",
  "$id": "https://constantin-jais.local/ecosystem/contracts/implementation-handoff.v0.1.schema.json",
  "title": "ImplementationHandoff v0.1",
  "description": "Planning-only Rumble-to-Bolt handoff contract for cos-matic P0.",
  "type": "object",
  "required": [
    "format",
    "kind",
    "source",
    "package",
    "planning_scope",
    "spec_context",
    "traceability_links",
    "active_waivers",
    "open_questions",
    "risks",
    "capability_candidates",
    "constraints",
    "requested_outputs",
    "execution_policy"
  ],
  "properties": {
    "format": {
      "const": "canvas.bolt_handoff.v0.1"
    },
    "kind": {
      "const": "planning_request"
    },
    "source": {
      "type": "object",
      "required": ["product", "workspace_id", "handoff_id", "created_by", "created_at"],
      "properties": {
        "product": { "type": "string", "minLength": 1 },
        "workspace_id": { "type": "string", "minLength": 1 },
        "handoff_id": { "type": "string", "minLength": 1 },
        "created_by": { "type": "string", "minLength": 1 },
        "created_at": { "$ref": "#/$defs/rfc3339Timestamp" }
      },
      "additionalProperties": true
    },
    "package": {
      "type": "object",
      "required": ["package_id", "version", "package_hash", "items"],
      "properties": {
        "package_id": { "type": "string", "minLength": 1 },
        "version": { "type": "string", "minLength": 1 },
        "package_hash": { "$ref": "#/$defs/sha256" },
        "artifact_reference_id": {
          "type": ["string", "null"],
          "minLength": 1
        },
        "artifact_hash": { "$ref": "#/$defs/sha256" },
        "artifact_manifest_version": { "type": "string", "minLength": 1 },
        "items": {
          "type": "array",
          "minItems": 1,
          "items": {
            "type": "object",
            "required": ["section_id", "revision_id"],
            "properties": {
              "section_id": { "type": "string", "minLength": 1 },
              "revision_id": { "type": "string", "minLength": 1 },
              "required": { "type": "boolean" }
            },
            "additionalProperties": true
          }
        }
      },
      "additionalProperties": true
    },
    "planning_scope": {
      "type": "object",
      "required": ["mode", "target_objects", "excluded_objects", "goal"],
      "properties": {
        "mode": { "enum": ["full_package", "slice"] },
        "target_objects": { "type": "array", "items": { "type": "string" } },
        "excluded_objects": { "type": "array", "items": { "type": "string" } },
        "goal": { "type": "string", "minLength": 1 }
      },
      "additionalProperties": true
    },
    "spec_context": {
      "type": "object",
      "required": ["charter_summary", "roles", "journeys", "screens", "actions", "domain_entities", "acceptance_criteria"],
      "properties": {
        "pii_classification": { "type": "string" },
        "charter_summary": { "type": "object" },
        "roles": { "type": "array", "items": { "type": "object" } },
        "journeys": { "type": "array", "items": { "type": "object" } },
        "screens": { "type": "array", "items": { "type": "object" } },
        "actions": { "type": "array", "items": { "type": "object" } },
        "domain_entities": { "type": "array", "items": { "type": "object" } },
        "acceptance_criteria": { "type": "array", "items": { "type": "object" } }
      },
      "additionalProperties": true
    },
    "traceability_links": {
      "type": "array",
      "items": {
        "type": "object",
        "required": ["source_type", "source_id", "target_type", "target_id", "relation_type"],
        "properties": {
          "source_type": { "type": "string", "minLength": 1 },
          "source_id": { "type": "string", "minLength": 1 },
          "target_type": { "type": "string", "minLength": 1 },
          "target_id": { "type": "string", "minLength": 1 },
          "relation_type": { "type": "string", "minLength": 1 }
        },
        "additionalProperties": true
      }
    },
    "active_waivers": {
      "type": "array",
      "items": { "$ref": "#/$defs/waiver" }
    },
    "open_questions": {
      "type": "array",
      "items": {
        "type": "object",
        "required": ["id"],
        "properties": {
          "id": { "type": "string", "minLength": 1 },
          "status": { "type": "string" },
          "blocking": { "type": "boolean" },
          "description": { "type": "string" },
          "waiver_id": { "type": "string" }
        },
        "additionalProperties": true
      }
    },
    "risks": {
      "type": "array",
      "items": {
        "type": "object",
        "required": ["id", "severity"],
        "properties": {
          "id": { "type": "string", "minLength": 1 },
          "severity": { "enum": ["low", "medium", "high", "critical"] },
          "status": { "type": "string" },
          "description": { "type": "string" },
          "waiver_id": { "type": "string" }
        },
        "additionalProperties": true
      }
    },
    "capability_candidates": {
      "type": "array",
      "items": {
        "type": "object",
        "properties": {
          "id": { "type": "string" },
          "name": { "type": "string" },
          "origin_type": { "type": "string" },
          "origin_id": { "type": "string" },
          "proposed_owner_layer": { "enum": ["rumble", "bolt", "wrench", "gear", "shared", "discuss"] },
          "status": { "type": "string" }
        },
        "additionalProperties": true
      }
    },
    "constraints": {
      "type": "object",
      "required": ["sovereignty", "data_residency", "non_goals"],
      "properties": {
        "sovereignty": { "type": "string", "minLength": 1 },
        "data_residency": { "type": "string", "minLength": 1 },
        "non_goals": { "type": "array", "items": { "type": "string" } },
        "forbidden_dependencies": { "type": "array", "items": { "type": "string" } },
        "requires_external_saas": { "type": "boolean" },
        "pii_in_logs_allowed": { "type": "boolean" }
      },
      "additionalProperties": true
    },
    "database_inspection": {
      "$ref": "#/$defs/databaseInspection"
    },
    "requested_outputs": {
      "type": "array",
      "minItems": 1,
      "items": {
        "enum": [
          "implementation_plan",
          "task_breakdown",
          "risk_review",
          "test_plan",
          "shared_capability_extraction_review"
        ]
      }
    },
    "execution_policy": {
      "type": "object",
      "required": ["planning_only", "allow_execution", "requires_human_approval_for_execution"],
      "properties": {
        "planning_only": { "const": true },
        "allow_execution": { "const": false },
        "requires_human_approval_for_execution": { "const": true }
      },
      "additionalProperties": true
    },
    "evidence_refs": {
      "type": "array",
      "items": { "$ref": "#/$defs/evidenceRef" }
    },
    "wrench_report_refs": {
      "type": "array",
      "items": { "$ref": "#/$defs/wrenchReportRef" }
    },
    "artifact_refs": {
      "type": "array",
      "items": { "$ref": "#/$defs/artifactRef" }
    }
  },
  "additionalProperties": true,
  "$defs": {
    "sha256": {
      "type": "string",
      "pattern": "^sha256:[0-9a-fA-F]{64}$"
    },
    "databaseInspection": {
      "oneOf": [
        {
          "type": "object",
          "required": ["applicability"],
          "properties": {
            "applicability": { "const": "not_applicable" }
          },
          "additionalProperties": false
        },
        {
          "type": "object",
          "required": ["applicability", "report"],
          "properties": {
            "applicability": { "const": "postgres" },
            "report": { "$ref": "#/$defs/databaseInspectionReportRef" }
          },
          "additionalProperties": false
        }
      ]
    },
    "databaseInspectionReportRef": {
      "type": "object",
      "required": ["artifact_ref", "sha256", "profile", "wrench_version"],
      "properties": {
        "artifact_ref": { "type": "string", "minLength": 1 },
        "sha256": { "$ref": "#/$defs/sha256" },
        "profile": { "type": "string", "minLength": 1 },
        "wrench_version": { "type": "string", "minLength": 1 }
      },
      "additionalProperties": false
    },
    "rfc3339Timestamp": {
      "type": "string",
      "pattern": "^\\d{4}-\\d{2}-\\d{2}T\\d{2}:\\d{2}:\\d{2}Z$"
    },
    "waiver": {
      "type": "object",
      "required": ["id", "status", "rationale"],
      "properties": {
        "id": { "type": "string", "minLength": 1 },
        "status": { "enum": ["accepted", "rejected", "expired", "draft"] },
        "rationale": { "type": "string", "minLength": 1 },
        "expires_at": { "$ref": "#/$defs/rfc3339Timestamp" },
        "approved_by": { "type": "string" },
        "reviewed_by": { "type": "string" },
        "target_ids": { "type": "array", "items": { "type": "string" } }
      },
      "additionalProperties": true
    },
    "evidenceRef": {
      "type": "object",
      "required": ["kind", "hash", "status"],
      "properties": {
        "kind": { "type": "string", "minLength": 1 },
        "artifact_reference_id": { "type": "string" },
        "hash": { "$ref": "#/$defs/sha256" },
        "status": { "enum": ["passed", "warning", "failed", "unavailable"] },
        "summary": { "type": "string" }
      },
      "additionalProperties": true
    },
    "wrenchReportRef": {
      "type": "object",
      "required": ["kind", "report_kind", "report_hash", "status"],
      "properties": {
        "kind": { "const": "wrench_report_ref" },
        "report_kind": { "enum": ["traceability", "privacy", "readiness", "policy", "citation_support"] },
        "artifact_reference_id": { "type": "string" },
        "report_hash": { "$ref": "#/$defs/sha256" },
        "status": { "enum": ["passed", "warning", "failed"] },
        "findings_summary": { "type": "array", "items": { "type": "object" } }
      },
      "additionalProperties": true
    },
    "artifactRef": {
      "type": "object",
      "required": ["kind", "artifact_reference_id", "artifact_kind", "manifest_version", "artifact_hash"],
      "properties": {
        "kind": { "const": "artifact_ref" },
        "artifact_reference_id": { "type": "string", "minLength": 1 },
        "artifact_kind": { "enum": ["spec_package", "handoff", "wrench_report", "plan", "evidence", "release_asset"] },
        "manifest_version": { "type": "string", "minLength": 1 },
        "artifact_hash": { "$ref": "#/$defs/sha256" }
      },
      "additionalProperties": true
    }
  }
}
