{
  "format": "canvas.bolt_handoff.v0.1",
  "kind": "planning_request",
  "source": {
    "product": "rumble-canvas",
    "workspace_id": "workspace-demo",
    "handoff_id": "handoff-demo-postgres-db-inspection",
    "created_by": "actor-owner-demo",
    "created_at": "2026-06-30T00:00:00Z"
  },
  "package": {
    "package_id": "package-demo",
    "version": "0.1.0",
    "package_hash": "sha256:0000000000000000000000000000000000000000000000000000000000000000",
    "artifact_reference_id": null,
    "items": [
      {
        "section_id": "section-charter",
        "revision_id": "revision-charter-1",
        "required": true
      }
    ]
  },
  "planning_scope": {
    "mode": "full_package",
    "target_objects": [],
    "excluded_objects": [],
    "goal": "Produce a planning-only implementation breakdown for the approved MVP slice."
  },
  "spec_context": {
    "pii_classification": "low: demo IDs and role/screen/action names only; no participant, email, free_text, raw responses, secrets, or private source content",
    "charter_summary": {
      "mission": "Validate a product-to-harness flow before product UI development."
    },
    "roles": [
      {
        "id": "role-owner",
        "name": "Owner"
      }
    ],
    "journeys": [
      {
        "id": "journey-create-package",
        "name": "Approve spec package"
      }
    ],
    "screens": [
      {
        "id": "screen-packages",
        "name": "Packages and Handoff"
      }
    ],
    "actions": [
      {
        "id": "action-request-handoff",
        "name": "Request Bolt handoff"
      }
    ],
    "domain_entities": [
      {
        "id": "entity-implementation-handoff",
        "name": "ImplementationHandoff"
      }
    ],
    "acceptance_criteria": [
      {
        "id": "acceptance-planning-only-validation",
        "text": "Given an approved package, when Owner requests handoff, then cos-matic validates planning-only payload."
      }
    ]
  },
  "traceability_links": [
    {
      "source_type": "journey",
      "source_id": "journey-create-package",
      "target_type": "screen",
      "target_id": "screen-packages",
      "relation_type": "requires"
    },
    {
      "source_type": "screen",
      "source_id": "screen-packages",
      "target_type": "action",
      "target_id": "action-request-handoff",
      "relation_type": "implements"
    },
    {
      "source_type": "action",
      "source_id": "action-request-handoff",
      "target_type": "acceptance_criteria",
      "target_id": "acceptance-planning-only-validation",
      "relation_type": "tests"
    },
    {
      "source_type": "action",
      "source_id": "action-request-handoff",
      "target_type": "capability_candidate",
      "target_id": "capability-implementation-handoff",
      "relation_type": "extracts_to_candidate"
    }
  ],
  "active_waivers": [],
  "open_questions": [],
  "risks": [],
  "capability_candidates": [
    {
      "id": "capability-implementation-handoff",
      "name": "Implementation handoff",
      "origin_type": "action",
      "origin_id": "action-request-handoff",
      "proposed_owner_layer": "bolt",
      "status": "accepted"
    }
  ],
  "constraints": {
    "sovereignty": "self-hostable; no hidden external dependency",
    "data_residency": "EU/local-first where applicable",
    "non_goals": [
      "No direct implementation execution from Rumble Canvas MVP"
    ]
  },
  "database_inspection": {
    "applicability": "postgres",
    "report": {
      "artifact_ref": "artifact:wrench-db-report-demo",
      "sha256": "sha256:bbbbbbbbbbbbbbbbbbbbbbbbbbbbbbbbbbbbbbbbbbbbbbbbbbbbbbbbbbbbbbbb",
      "profile": "protected_branch",
      "wrench_version": "0.1.0-alpha.2"
    }
  },
  "requested_outputs": [
    "implementation_plan",
    "task_breakdown",
    "risk_review",
    "test_plan",
    "shared_capability_extraction_review"
  ],
  "execution_policy": {
    "planning_only": true,
    "allow_execution": false,
    "requires_human_approval_for_execution": true
  }
}
